{
  "id": "resolve/asks-with-the-consumers-constraints-before-falling-back",
  "op": "resolve",
  "covers": "12.4",
  "given": {
    "requirement": {
      "id": "storage.object",
      "constraints": {
        "minReplicas": 3
      },
      "degradable": true
    },
    "provider": {
      "advertised": {
        "maxReplicas": 1
      },
      "attributesByPoll": [
        {
          "maxReplicas": 1
        }
      ],
      "servesOnlyUnconstrained": true
    },
    "budgetMillis": 2000,
    "pollMillis": 1000
  },
  "then": {
    "asks": {
      "equals": [
        true,
        false
      ]
    },
    "degraded": true
  }
}
