{
  "id": "resolve/serves-when-attributes-satisfy-before-the-deadline",
  "op": "resolve",
  "covers": "12.4",
  "given": {
    "requirement": {
      "id": "storage.object",
      "constraints": {
        "minReplicas": 3
      },
      "degradable": false
    },
    "provider": {
      "advertised": {
        "maxReplicas": 1
      },
      "attributesByPoll": [
        {
          "maxReplicas": 1
        },
        {
          "maxReplicas": 3
        }
      ]
    },
    "budgetMillis": 30000,
    "pollMillis": 1000
  },
  "then": {
    "served": true,
    "atPoll": 2,
    "degraded": false,
    "refusal": null
  }
}
