{
  "id": "validate/accepts-a-correct-manifest",
  "op": "validate",
  "covers": "12.6",
  "given": {
    "schema": "https://weivel.github.io/model/plugin.schema.json",
    "manifest": {
      "id": "config-ledger",
      "api": 1,
      "entry": "dist/index.js",
      "capabilities": [
        "provider"
      ]
    }
  },
  "then": {
    "valid": true,
    "paths": {
      "equals": []
    },
    "refusal": null
  }
}
